{
  "module_key": "compliance_reviews",
  "manifest_version": "h6f-pre-activation-template-v1",
  "schema_version": "compliance_reviews_h6b_v1",
  "required_application_commit": "REPLACE_WITH_DEPLOYED_COMMIT",
  "target_environment": "production",
  "target_database_path": "REPLACE_WITH_VERIFIED_PERSISTENT_DB_PATH",
  "expected_pre_migration_sha256": "REPLACE_WITH_PRE_MIGRATION_DATABASE_SHA256",
  "expected_role_permission_count": 25,
  "expected_permission_set_hash": "REPLACE_WITH_APPROVED_PERMISSION_SET_HASH",
  "permission_migration": {
    "name": "add_compliance_review_permissions_h6e",
    "path": "migrations/add_compliance_review_permissions.py",
    "mode": "apply_after_separate_authorization"
  },
  "activation_migration": {
    "name": "activate_compliance_review_foundation_h6b",
    "path": "migrations/activate_compliance_review_foundation.py",
    "schema_version": "compliance_reviews_h6b_v1"
  },
  "backup_path": "REPLACE_WITH_VERIFIED_BACKUP_PATH_OUTSIDE_REPOSITORY",
  "backup_sha256": "REPLACE_WITH_BACKUP_SHA256",
  "requested_by": "REPLACE_WITH_NAMED_INSTITUTIONAL_REQUESTER",
  "approved_by": "REPLACE_WITH_DIFFERENT_NAMED_INSTITUTIONAL_APPROVER",
  "authority_basis": "REPLACE_WITH_APPROVED_AUTHORITY_BASIS",
  "migration_executor": "REPLACE_WITH_NAMED_MIGRATION_EXECUTOR",
  "post_migration_verifier": "REPLACE_WITH_NAMED_VERIFIER",
  "rollback_owner": "REPLACE_WITH_NAMED_ROLLBACK_OWNER",
  "activation_window": {
    "starts_at": "YYYY-MM-DDTHH:MM:SSZ",
    "ends_at": "YYYY-MM-DDTHH:MM:SSZ"
  },
  "certification_owner": "REPLACE_WITH_NAMED_CERTIFICATION_OWNER",
  "write_freeze_confirmed": false,
  "active_connections_confirmed": false,
  "permission_migration_authorized": false,
  "activation_migration_authorized": false,
  "controlled_create_test_authorized": false,
  "rollback_authorized": false,
  "token_reference": "REFERENCE_ONLY_NO_SECRET_VALUE"
}
